{
  "schemaVersion": "historical-snapshot-2.0.0",
  "snapshotId": "snapshot-2026-09-02T13-00-00-000Z-307a1488f8",
  "generatedAt": "2026-09-02T13:00:00.000Z",
  "corpusGeneratedAt": "2026-08-31T11:55:00Z",
  "inputHash": "307a1488f896c585bcb3da882df66a8a40cb403acd62539d720320b8b75cc006",
  "analysisVersion": "static-corpus-analysis-2.0.0",
  "classificationVersion": "weighted-lexical-3.0.0",
  "queryVersion": "search-3.0.0",
  "ontologyVersion": "human-work-themes-3.0.0",
  "methodVersions": {
    "trends": "equal-windows-2.0.0",
    "questions": "evidence-questions-2.0.0",
    "opportunities": "opportunity-components-2.0.0",
    "snapshot": "analysis-snapshot-2.0.0"
  },
  "coverage": {
    "currentYear": 2026,
    "latestStableYear": 2025,
    "excludedYears": [
      2026
    ],
    "corpusStartYear": 2026,
    "corpusEndYear": 2026,
    "totalWorks": 1,
    "publications": 1,
    "preprints": 0,
    "journalCount": 1,
    "proceedingsCount": 0,
    "corpusComplete": true,
    "callsStatus": "ready"
  },
  "totals": {
    "found": 1,
    "analyzed": 1,
    "publications": 1,
    "preprints": 0,
    "calls": 1,
    "lensQuestions": 8,
    "dataDerivedQuestions": 1
  },
  "sourceStatus": [
    {
      "source": "OpenAlex",
      "status": "healthy",
      "recordCount": 1,
      "checkedAt": "2026-08-31T11:55:00Z",
      "message": null
    }
  ],
  "themeCounts": [
    {
      "theme": "learning",
      "count": 0,
      "journalCount": 0,
      "preprintCount": 0,
      "proceedingsCount": 0
    },
    {
      "theme": "trust",
      "count": 0,
      "journalCount": 0,
      "preprintCount": 0,
      "proceedingsCount": 0
    },
    {
      "theme": "agency",
      "count": 1,
      "journalCount": 1,
      "preprintCount": 0,
      "proceedingsCount": 0
    },
    {
      "theme": "cognition",
      "count": 0,
      "journalCount": 0,
      "preprintCount": 0,
      "proceedingsCount": 0
    },
    {
      "theme": "teaming",
      "count": 1,
      "journalCount": 1,
      "preprintCount": 0,
      "proceedingsCount": 0
    },
    {
      "theme": "motivation",
      "count": 0,
      "journalCount": 0,
      "preprintCount": 0,
      "proceedingsCount": 0
    },
    {
      "theme": "safety",
      "count": 0,
      "journalCount": 0,
      "preprintCount": 0,
      "proceedingsCount": 0
    },
    {
      "theme": "participation",
      "count": 0,
      "journalCount": 0,
      "preprintCount": 0,
      "proceedingsCount": 0
    }
  ],
  "signals": [
    {
      "theme": "learning",
      "publicationTrend": "insufficient",
      "emergingSignal": "insufficient",
      "agendaSignal": "weak",
      "opportunityStatus": "insufficient",
      "opportunityScore": null,
      "uncertainty": "high"
    },
    {
      "theme": "trust",
      "publicationTrend": "insufficient",
      "emergingSignal": "insufficient",
      "agendaSignal": "weak",
      "opportunityStatus": "insufficient",
      "opportunityScore": null,
      "uncertainty": "high"
    },
    {
      "theme": "agency",
      "publicationTrend": "insufficient",
      "emergingSignal": "insufficient",
      "agendaSignal": "weak",
      "opportunityStatus": "insufficient",
      "opportunityScore": null,
      "uncertainty": "high"
    },
    {
      "theme": "cognition",
      "publicationTrend": "insufficient",
      "emergingSignal": "insufficient",
      "agendaSignal": "weak",
      "opportunityStatus": "insufficient",
      "opportunityScore": null,
      "uncertainty": "high"
    },
    {
      "theme": "teaming",
      "publicationTrend": "insufficient",
      "emergingSignal": "insufficient",
      "agendaSignal": "moderate",
      "opportunityStatus": "insufficient",
      "opportunityScore": null,
      "uncertainty": "high"
    },
    {
      "theme": "motivation",
      "publicationTrend": "insufficient",
      "emergingSignal": "insufficient",
      "agendaSignal": "weak",
      "opportunityStatus": "insufficient",
      "opportunityScore": null,
      "uncertainty": "high"
    },
    {
      "theme": "safety",
      "publicationTrend": "insufficient",
      "emergingSignal": "insufficient",
      "agendaSignal": "weak",
      "opportunityStatus": "insufficient",
      "opportunityScore": null,
      "uncertainty": "high"
    },
    {
      "theme": "participation",
      "publicationTrend": "insufficient",
      "emergingSignal": "insufficient",
      "agendaSignal": "weak",
      "opportunityStatus": "insufficient",
      "opportunityScore": null,
      "uncertainty": "high"
    }
  ],
  "warnings": [
    {
      "code": "running-or-indexing-lag-years-excluded",
      "severity": "warning",
      "message": "Aus Trendvergleichen ausgeschlossen: 2026.",
      "affectedRecords": 1
    },
    {
      "code": "no-stable-year-records",
      "severity": "warning",
      "message": "Der Korpus enthält keine Publikationen in vollständig abgeschlossenen Vergleichsjahren.",
      "affectedRecords": 1
    }
  ]
}
