{
  "schemaVersion": "historical-snapshot-2.0.0",
  "snapshotId": "snapshot-2026-10-22T10-14-36-875Z-6870d30b63",
  "generatedAt": "2026-10-22T10:14:36.875Z",
  "corpusGeneratedAt": "2026-09-11T11:08:00.527Z",
  "inputHash": "6870d30b63c057ae8bd146d28aec1b96927578a6d5e214a2d92818ec0343f13b",
  "analysisVersion": "static-corpus-analysis-3.0.0",
  "classificationVersion": "text-supported-lexical-4.0.0",
  "queryVersion": "static-search-5.0.0",
  "ontologyVersion": "human-work-themes-4.0.0",
  "methodVersions": {
    "trends": "equal-windows-2.1.0",
    "questions": "evidence-questions-2.1.0",
    "opportunities": "opportunity-components-2.1.0",
    "snapshot": "analysis-snapshot-2.0.0"
  },
  "coverage": {
    "currentYear": 2026,
    "latestStableYear": 2025,
    "excludedYears": [
      2026
    ],
    "corpusStartYear": 2018,
    "corpusEndYear": 2026,
    "comparisonMode": "core",
    "totalWorks": 3523,
    "searchableWorks": 30137,
    "publications": 3518,
    "preprints": 5,
    "journalCount": 2885,
    "proceedingsCount": 633,
    "corpusComplete": false,
    "callsStatus": "partial"
  },
  "totals": {
    "found": 30137,
    "analyzed": 30137,
    "publications": 20363,
    "preprints": 9774,
    "calls": 22,
    "lensQuestions": 8,
    "dataDerivedQuestions": 4
  },
  "sourceStatus": [
    {
      "source": "OpenAlex (core · human-ai · fresh)",
      "status": "healthy",
      "recordCount": 31,
      "checkedAt": "2026-10-22T10:13:51.313Z",
      "message": null
    },
    {
      "source": "OpenAlex (core · human-factors · fresh)",
      "status": "healthy",
      "recordCount": 181,
      "checkedAt": "2026-10-22T10:13:51.313Z",
      "message": null
    },
    {
      "source": "OpenAlex (broad · human-ai · fresh)",
      "status": "degraded",
      "recordCount": 500,
      "checkedAt": "2026-10-22T10:13:51.313Z",
      "message": "Seitenbudget erreicht; der nächste Lauf setzt diesen Zeitraum am gespeicherten Cursor fort."
    },
    {
      "source": "OpenAlex (broad · human-factors · fresh)",
      "status": "degraded",
      "recordCount": 500,
      "checkedAt": "2026-10-22T10:13:51.313Z",
      "message": "Seitenbudget erreicht; der nächste Lauf setzt diesen Zeitraum am gespeicherten Cursor fort."
    },
    {
      "source": "OpenAlex (frontier · human-ai · fresh)",
      "status": "degraded",
      "recordCount": 500,
      "checkedAt": "2026-10-22T10:13:51.313Z",
      "message": "Seitenbudget erreicht; der nächste Lauf setzt diesen Zeitraum am gespeicherten Cursor fort."
    },
    {
      "source": "OpenAlex (frontier · human-ai · backfill)",
      "status": "degraded",
      "recordCount": 200,
      "checkedAt": "2026-10-22T10:13:51.313Z",
      "message": "Seitenbudget erreicht; der nächste Lauf setzt diesen Zeitraum am gespeicherten Cursor fort."
    },
    {
      "source": "OpenAlex (frontier · human-ai · recheck)",
      "status": "healthy",
      "recordCount": 108,
      "checkedAt": "2026-10-22T10:13:51.313Z",
      "message": null
    },
    {
      "source": "arXiv (frontier · human-ai · fresh)",
      "status": "stale",
      "recordCount": 0,
      "checkedAt": "2026-10-22T10:13:51.313Z",
      "message": "arXiv antwortete mit HTTP 400"
    },
    {
      "source": "arXiv (frontier · human-ai · backfill)",
      "status": "stale",
      "recordCount": 0,
      "checkedAt": "2026-10-22T10:13:51.313Z",
      "message": "arXiv antwortete mit HTTP 400"
    },
    {
      "source": "arXiv (frontier · human-ai · recheck)",
      "status": "stale",
      "recordCount": 0,
      "checkedAt": "2026-10-22T10:13:51.313Z",
      "message": "arXiv antwortete mit HTTP 400"
    },
    {
      "source": "OpenAlex (frontier · human-factors · fresh)",
      "status": "healthy",
      "recordCount": 94,
      "checkedAt": "2026-10-22T10:13:51.313Z",
      "message": null
    },
    {
      "source": "arXiv (frontier · human-factors · fresh)",
      "status": "healthy",
      "recordCount": 26,
      "checkedAt": "2026-10-22T10:13:51.313Z",
      "message": null
    },
    {
      "source": "Crossref (core, broad, frontier)",
      "status": "not_checked",
      "recordCount": 0,
      "checkedAt": "2026-10-22T10:13:51.313Z",
      "message": "Crossref-Enrichment wurde für diesen Lauf explizit deaktiviert."
    }
  ],
  "themeCounts": [
    {
      "theme": "learning",
      "count": 523,
      "journalCount": 398,
      "preprintCount": 2,
      "proceedingsCount": 123
    },
    {
      "theme": "trust",
      "count": 830,
      "journalCount": 621,
      "preprintCount": 0,
      "proceedingsCount": 209
    },
    {
      "theme": "agency",
      "count": 295,
      "journalCount": 235,
      "preprintCount": 1,
      "proceedingsCount": 59
    },
    {
      "theme": "cognition",
      "count": 742,
      "journalCount": 535,
      "preprintCount": 1,
      "proceedingsCount": 206
    },
    {
      "theme": "teaming",
      "count": 350,
      "journalCount": 246,
      "preprintCount": 0,
      "proceedingsCount": 104
    },
    {
      "theme": "motivation",
      "count": 720,
      "journalCount": 577,
      "preprintCount": 0,
      "proceedingsCount": 143
    },
    {
      "theme": "safety",
      "count": 794,
      "journalCount": 629,
      "preprintCount": 3,
      "proceedingsCount": 162
    },
    {
      "theme": "participation",
      "count": 393,
      "journalCount": 300,
      "preprintCount": 2,
      "proceedingsCount": 91
    }
  ],
  "signals": [
    {
      "theme": "learning",
      "publicationTrend": "insufficient",
      "emergingSignal": "insufficient",
      "agendaSignal": "weak",
      "opportunityStatus": "insufficient",
      "opportunityScore": null,
      "uncertainty": "high"
    },
    {
      "theme": "trust",
      "publicationTrend": "insufficient",
      "emergingSignal": "insufficient",
      "agendaSignal": "weak",
      "opportunityStatus": "insufficient",
      "opportunityScore": null,
      "uncertainty": "high"
    },
    {
      "theme": "agency",
      "publicationTrend": "insufficient",
      "emergingSignal": "insufficient",
      "agendaSignal": "weak",
      "opportunityStatus": "insufficient",
      "opportunityScore": null,
      "uncertainty": "high"
    },
    {
      "theme": "cognition",
      "publicationTrend": "insufficient",
      "emergingSignal": "insufficient",
      "agendaSignal": "weak",
      "opportunityStatus": "insufficient",
      "opportunityScore": null,
      "uncertainty": "high"
    },
    {
      "theme": "teaming",
      "publicationTrend": "insufficient",
      "emergingSignal": "insufficient",
      "agendaSignal": "moderate",
      "opportunityStatus": "insufficient",
      "opportunityScore": null,
      "uncertainty": "high"
    },
    {
      "theme": "motivation",
      "publicationTrend": "insufficient",
      "emergingSignal": "insufficient",
      "agendaSignal": "weak",
      "opportunityStatus": "insufficient",
      "opportunityScore": null,
      "uncertainty": "high"
    },
    {
      "theme": "safety",
      "publicationTrend": "insufficient",
      "emergingSignal": "insufficient",
      "agendaSignal": "weak",
      "opportunityStatus": "insufficient",
      "opportunityScore": null,
      "uncertainty": "high"
    },
    {
      "theme": "participation",
      "publicationTrend": "insufficient",
      "emergingSignal": "insufficient",
      "agendaSignal": "weak",
      "opportunityStatus": "insufficient",
      "opportunityScore": null,
      "uncertainty": "high"
    }
  ],
  "warnings": [
    {
      "code": "running-or-indexing-lag-years-excluded",
      "severity": "warning",
      "message": "Aus Trendvergleichen ausgeschlossen: 2026.",
      "affectedRecords": 1607
    },
    {
      "code": "partial-publication-corpus",
      "severity": "warning",
      "message": "Nicht alle vorgesehenen Suchmodi liegen im statischen Korpus vor.",
      "affectedRecords": 3523
    },
    {
      "code": "partial-agenda-sources",
      "severity": "warning",
      "message": "Agenda Signals beruhen auf einer nur teilweise verfügbaren offiziellen Calls-Registry.",
      "affectedRecords": 2
    },
    {
      "code": "missing-abstracts",
      "severity": "info",
      "message": "3904 Arbeiten besitzen kein Abstract; ihre Klassifikation nutzt die übrigen Felder.",
      "affectedRecords": 3904
    }
  ],
  "researchEvaluation": {
    "queryVersion": "static-search-5.0.0",
    "methodVersion": "static-corpus-analysis-3.0.0",
    "coverageComplete": false,
    "themeCounts90": {
      "learning": 3430,
      "trust": 3023,
      "agency": 1525,
      "cognition": 2488,
      "teaming": 838,
      "motivation": 1764,
      "safety": 3722,
      "participation": 2418
    }
  }
}
