{
  "schemaVersion": "historical-snapshot-2.0.0",
  "snapshotId": "snapshot-2026-09-22T08-39-41-017Z-ab1ab80567",
  "generatedAt": "2026-09-22T08:39:41.017Z",
  "corpusGeneratedAt": "2026-09-11T11:08:00.527Z",
  "inputHash": "ab1ab80567cd673bfce7301acd69686ab0cb3c5c23080738ba45d151a4c7b6b6",
  "analysisVersion": "static-corpus-analysis-2.1.0",
  "classificationVersion": "weighted-lexical-3.0.0",
  "queryVersion": "static-search-4.0.0",
  "ontologyVersion": "human-work-themes-3.0.0",
  "methodVersions": {
    "trends": "equal-windows-2.1.0",
    "questions": "evidence-questions-2.1.0",
    "opportunities": "opportunity-components-2.1.0",
    "snapshot": "analysis-snapshot-2.0.0"
  },
  "coverage": {
    "currentYear": 2026,
    "latestStableYear": 2025,
    "excludedYears": [
      2026
    ],
    "corpusStartYear": 2018,
    "corpusEndYear": 2026,
    "comparisonMode": "core",
    "totalWorks": 1712,
    "searchableWorks": 4099,
    "publications": 1712,
    "preprints": 0,
    "journalCount": 1385,
    "proceedingsCount": 327,
    "corpusComplete": true,
    "callsStatus": "partial"
  },
  "totals": {
    "found": 4099,
    "analyzed": 4099,
    "publications": 2707,
    "preprints": 1392,
    "calls": 22,
    "lensQuestions": 8,
    "dataDerivedQuestions": 4
  },
  "sourceStatus": [
    {
      "source": "OpenAlex (core)",
      "status": "healthy",
      "recordCount": 208,
      "checkedAt": "2026-09-22T08:39:04.283Z",
      "message": null
    },
    {
      "source": "OpenAlex (broad)",
      "status": "degraded",
      "recordCount": 500,
      "checkedAt": "2026-09-22T08:39:04.283Z",
      "message": "Seitenbudget erreicht; der nächste Lauf setzt diesen Zeitraum am gespeicherten Cursor fort."
    },
    {
      "source": "OpenAlex (frontier)",
      "status": "degraded",
      "recordCount": 500,
      "checkedAt": "2026-09-22T08:39:04.283Z",
      "message": "Seitenbudget erreicht; der nächste Lauf setzt diesen Zeitraum am gespeicherten Cursor fort."
    },
    {
      "source": "arXiv (frontier)",
      "status": "degraded",
      "recordCount": 500,
      "checkedAt": "2026-09-22T08:39:04.283Z",
      "message": "Seitenbudget erreicht; Fortsetzung am gespeicherten Offset."
    },
    {
      "source": "Crossref (core, broad, frontier)",
      "status": "not_checked",
      "recordCount": 0,
      "checkedAt": "2026-09-22T08:39:04.283Z",
      "message": "Crossref-Enrichment wurde für diesen Lauf explizit deaktiviert."
    }
  ],
  "themeCounts": [
    {
      "theme": "learning",
      "count": 227,
      "journalCount": 185,
      "preprintCount": 0,
      "proceedingsCount": 42
    },
    {
      "theme": "trust",
      "count": 391,
      "journalCount": 301,
      "preprintCount": 0,
      "proceedingsCount": 90
    },
    {
      "theme": "agency",
      "count": 185,
      "journalCount": 163,
      "preprintCount": 0,
      "proceedingsCount": 22
    },
    {
      "theme": "cognition",
      "count": 244,
      "journalCount": 175,
      "preprintCount": 0,
      "proceedingsCount": 69
    },
    {
      "theme": "teaming",
      "count": 148,
      "journalCount": 105,
      "preprintCount": 0,
      "proceedingsCount": 43
    },
    {
      "theme": "motivation",
      "count": 204,
      "journalCount": 176,
      "preprintCount": 0,
      "proceedingsCount": 28
    },
    {
      "theme": "safety",
      "count": 513,
      "journalCount": 372,
      "preprintCount": 0,
      "proceedingsCount": 141
    },
    {
      "theme": "participation",
      "count": 137,
      "journalCount": 127,
      "preprintCount": 0,
      "proceedingsCount": 10
    }
  ],
  "signals": [
    {
      "theme": "learning",
      "publicationTrend": "growing",
      "emergingSignal": "rising",
      "agendaSignal": "weak",
      "opportunityStatus": "low",
      "opportunityScore": 39,
      "uncertainty": "medium"
    },
    {
      "theme": "trust",
      "publicationTrend": "declining",
      "emergingSignal": "cooling",
      "agendaSignal": "weak",
      "opportunityStatus": "low",
      "opportunityScore": 29,
      "uncertainty": "medium"
    },
    {
      "theme": "agency",
      "publicationTrend": "declining",
      "emergingSignal": "cooling",
      "agendaSignal": "weak",
      "opportunityStatus": "low",
      "opportunityScore": 31,
      "uncertainty": "medium"
    },
    {
      "theme": "cognition",
      "publicationTrend": "declining",
      "emergingSignal": "cooling",
      "agendaSignal": "weak",
      "opportunityStatus": "low",
      "opportunityScore": 29,
      "uncertainty": "medium"
    },
    {
      "theme": "teaming",
      "publicationTrend": "stable",
      "emergingSignal": "stable",
      "agendaSignal": "strong",
      "opportunityStatus": "mixed",
      "opportunityScore": 56,
      "uncertainty": "medium"
    },
    {
      "theme": "motivation",
      "publicationTrend": "growing",
      "emergingSignal": "stable",
      "agendaSignal": "weak",
      "opportunityStatus": "low",
      "opportunityScore": 30,
      "uncertainty": "medium"
    },
    {
      "theme": "safety",
      "publicationTrend": "declining",
      "emergingSignal": "cooling",
      "agendaSignal": "weak",
      "opportunityStatus": "low",
      "opportunityScore": 30,
      "uncertainty": "medium"
    },
    {
      "theme": "participation",
      "publicationTrend": "growing",
      "emergingSignal": "rising",
      "agendaSignal": "weak",
      "opportunityStatus": "low",
      "opportunityScore": 38,
      "uncertainty": "medium"
    }
  ],
  "warnings": [
    {
      "code": "running-or-indexing-lag-years-excluded",
      "severity": "warning",
      "message": "Aus Trendvergleichen ausgeschlossen: 2026.",
      "affectedRecords": 526
    },
    {
      "code": "partial-agenda-sources",
      "severity": "warning",
      "message": "Agenda Signals beruhen auf einer nur teilweise verfügbaren offiziellen Calls-Registry.",
      "affectedRecords": 9
    },
    {
      "code": "missing-abstracts",
      "severity": "info",
      "message": "644 Arbeiten besitzen kein Abstract; ihre Klassifikation nutzt die übrigen Felder.",
      "affectedRecords": 644
    }
  ]
}
