{
  "schemaVersion": "historical-snapshot-2.0.0",
  "snapshotId": "snapshot-2026-09-11T11-01-34-896Z-77955e2faf",
  "generatedAt": "2026-09-11T11:01:34.896Z",
  "corpusGeneratedAt": "2026-09-02T09:44:20.022Z",
  "inputHash": "77955e2faf47a0bfacba481eee3c9128f24933794e27c2a0f3db41bb093aacf4",
  "analysisVersion": "static-corpus-analysis-2.1.0",
  "classificationVersion": "weighted-lexical-3.0.0",
  "queryVersion": "static-search-4.0.0",
  "ontologyVersion": "human-work-themes-3.0.0",
  "methodVersions": {
    "trends": "equal-windows-2.1.0",
    "questions": "evidence-questions-2.1.0",
    "opportunities": "opportunity-components-2.1.0",
    "snapshot": "analysis-snapshot-2.0.0"
  },
  "coverage": {
    "currentYear": 2026,
    "latestStableYear": 2025,
    "excludedYears": [
      2026
    ],
    "corpusStartYear": 2022,
    "corpusEndYear": 2026,
    "comparisonMode": "core",
    "totalWorks": 1398,
    "searchableWorks": 1398,
    "publications": 1398,
    "preprints": 0,
    "journalCount": 1143,
    "proceedingsCount": 255,
    "corpusComplete": false,
    "callsStatus": "partial"
  },
  "totals": {
    "found": 1398,
    "analyzed": 1398,
    "publications": 1398,
    "preprints": 0,
    "calls": 22,
    "lensQuestions": 8,
    "dataDerivedQuestions": 4
  },
  "sourceStatus": [
    {
      "source": "OpenAlex (core)",
      "status": "degraded",
      "recordCount": 500,
      "checkedAt": "2026-09-11T11:01:24.625Z",
      "message": "Seitenbudget erreicht; der nächste Lauf setzt diesen Zeitraum am gespeicherten Cursor fort."
    },
    {
      "source": "Crossref (core)",
      "status": "not_checked",
      "recordCount": 0,
      "checkedAt": "2026-09-11T11:01:24.625Z",
      "message": "Crossref-Enrichment wurde für diesen Lauf explizit deaktiviert."
    }
  ],
  "themeCounts": [
    {
      "theme": "learning",
      "count": 202,
      "journalCount": 166,
      "preprintCount": 0,
      "proceedingsCount": 36
    },
    {
      "theme": "trust",
      "count": 310,
      "journalCount": 240,
      "preprintCount": 0,
      "proceedingsCount": 70
    },
    {
      "theme": "agency",
      "count": 150,
      "journalCount": 133,
      "preprintCount": 0,
      "proceedingsCount": 17
    },
    {
      "theme": "cognition",
      "count": 196,
      "journalCount": 140,
      "preprintCount": 0,
      "proceedingsCount": 56
    },
    {
      "theme": "teaming",
      "count": 121,
      "journalCount": 91,
      "preprintCount": 0,
      "proceedingsCount": 30
    },
    {
      "theme": "motivation",
      "count": 177,
      "journalCount": 156,
      "preprintCount": 0,
      "proceedingsCount": 21
    },
    {
      "theme": "safety",
      "count": 393,
      "journalCount": 284,
      "preprintCount": 0,
      "proceedingsCount": 109
    },
    {
      "theme": "participation",
      "count": 121,
      "journalCount": 113,
      "preprintCount": 0,
      "proceedingsCount": 8
    }
  ],
  "signals": [
    {
      "theme": "learning",
      "publicationTrend": "insufficient",
      "emergingSignal": "rising",
      "agendaSignal": "weak",
      "opportunityStatus": "insufficient",
      "opportunityScore": null,
      "uncertainty": "high"
    },
    {
      "theme": "trust",
      "publicationTrend": "insufficient",
      "emergingSignal": "stable",
      "agendaSignal": "weak",
      "opportunityStatus": "insufficient",
      "opportunityScore": null,
      "uncertainty": "high"
    },
    {
      "theme": "agency",
      "publicationTrend": "insufficient",
      "emergingSignal": "stable",
      "agendaSignal": "weak",
      "opportunityStatus": "insufficient",
      "opportunityScore": null,
      "uncertainty": "high"
    },
    {
      "theme": "cognition",
      "publicationTrend": "insufficient",
      "emergingSignal": "cooling",
      "agendaSignal": "weak",
      "opportunityStatus": "insufficient",
      "opportunityScore": null,
      "uncertainty": "high"
    },
    {
      "theme": "teaming",
      "publicationTrend": "insufficient",
      "emergingSignal": "stable",
      "agendaSignal": "strong",
      "opportunityStatus": "insufficient",
      "opportunityScore": null,
      "uncertainty": "high"
    },
    {
      "theme": "motivation",
      "publicationTrend": "insufficient",
      "emergingSignal": "stable",
      "agendaSignal": "weak",
      "opportunityStatus": "insufficient",
      "opportunityScore": null,
      "uncertainty": "high"
    },
    {
      "theme": "safety",
      "publicationTrend": "insufficient",
      "emergingSignal": "cooling",
      "agendaSignal": "weak",
      "opportunityStatus": "insufficient",
      "opportunityScore": null,
      "uncertainty": "high"
    },
    {
      "theme": "participation",
      "publicationTrend": "insufficient",
      "emergingSignal": "rising",
      "agendaSignal": "weak",
      "opportunityStatus": "insufficient",
      "opportunityScore": null,
      "uncertainty": "high"
    }
  ],
  "warnings": [
    {
      "code": "running-or-indexing-lag-years-excluded",
      "severity": "warning",
      "message": "Aus Trendvergleichen ausgeschlossen: 2026.",
      "affectedRecords": 512
    },
    {
      "code": "partial-publication-corpus",
      "severity": "warning",
      "message": "Nicht alle vorgesehenen Suchmodi liegen im statischen Korpus vor.",
      "affectedRecords": 1398
    },
    {
      "code": "partial-agenda-sources",
      "severity": "warning",
      "message": "Agenda Signals beruhen auf einer nur teilweise verfügbaren offiziellen Calls-Registry.",
      "affectedRecords": 10
    },
    {
      "code": "missing-abstracts",
      "severity": "info",
      "message": "318 Arbeiten besitzen kein Abstract; ihre Klassifikation nutzt die übrigen Felder.",
      "affectedRecords": 318
    }
  ]
}
